{
  "$schema": "https://json-schema.org/draft/2020-12/schema",
  "title": "Gate Trace Record",
  "type": "object",
  "required": [
    "schema_id",
    "schema_version",
    "created_at",
    "producer_version",
    "trace_id",
    "tool_name",
    "args_digest",
    "intent_digest",
    "policy_digest",
    "verdict"
  ],
  "properties": {
    "schema_id": { "type": "string", "const": "gait.gate.trace" },
    "schema_version": { "type": "string", "pattern": "^1\\.0\\.0$" },
    "created_at": { "type": "string", "format": "date-time" },
    "observed_at": { "type": "string", "format": "date-time" },
    "producer_version": { "type": "string" },
    "trace_id": { "type": "string" },
    "event_id": { "type": "string" },
    "correlation_id": { "type": "string" },
    "tool_name": { "type": "string" },
    "args_digest": { "type": "string", "pattern": "^[a-fA-F0-9]{64}$" },
    "intent_digest": { "type": "string", "pattern": "^[a-fA-F0-9]{64}$" },
    "policy_digest": { "type": "string", "pattern": "^[a-fA-F0-9]{64}$" },
    "contract_family_id": { "type": "string", "minLength": 1 },
    "contract_id": { "type": "string", "minLength": 1 },
    "contract_revision": { "type": "integer", "minimum": 1 },
    "proposal_digest": { "type": "string", "pattern": "^[a-fA-F0-9]{64}$" },
    "activation_digest": { "type": "string", "pattern": "^[a-fA-F0-9]{64}$" },
    "readiness_digest": { "type": "string", "pattern": "^[a-fA-F0-9]{64}$" },
    "expected_outcome": { "type": "string", "minLength": 1 },
    "expected_effect": { "type": "array", "items": { "type": "string", "minLength": 1 }, "uniqueItems": true },
    "expected_containment": { "type": "array", "items": { "type": "string", "minLength": 1 }, "uniqueItems": true },
    "agent_id": { "type": "string", "minLength": 1 },
    "agent_identity": {
      "type": "object",
      "properties": {
        "lifecycle_states": {
          "type": "array",
          "items": { "type": "string", "minLength": 1 }
        },
        "owner": { "type": "string", "minLength": 1 },
        "manifest_digest": { "type": "string", "pattern": "^[a-fA-F0-9]{64}$" },
        "publisher": { "type": "string", "minLength": 1 },
        "source": { "type": "string", "minLength": 1 },
        "issued_at": { "type": "string", "format": "date-time" },
        "approved_at": { "type": "string", "format": "date-time" },
        "expires_at": { "type": "string", "format": "date-time" },
        "revoked": { "type": "boolean" }
      },
      "additionalProperties": false
    },
    "run_id": { "type": "string", "minLength": 1 },
    "workflow_id": { "type": "string", "minLength": 1 },
    "repo": { "type": "string", "minLength": 1 },
    "environment": { "type": "string", "minLength": 1 },
    "credential_ref": { "type": "string", "minLength": 1 },
    "credential_source": { "type": "string", "minLength": 1 },
    "credential_access_type": { "type": "string", "minLength": 1 },
    "credential_issuer": { "type": "string", "minLength": 1 },
    "credential_subject": { "type": "string", "minLength": 1 },
    "credential_owner": { "type": "string", "minLength": 1 },
    "credential_target_binding": { "type": "string", "minLength": 1 },
    "credential_run_binding": { "type": "string", "minLength": 1 },
    "credential_job_binding": { "type": "string", "minLength": 1 },
    "credential_ttl_seconds": { "type": "integer", "minimum": 1 },
    "broker_credential_ref": { "type": "string", "minLength": 1 },
    "broker_credential_source": { "type": "string", "minLength": 1 },
    "broker_credential_access_type": { "type": "string", "minLength": 1 },
    "broker_credential_issuer": { "type": "string", "minLength": 1 },
    "broker_request_digest": { "type": "string", "pattern": "^[a-fA-F0-9]{64}$" },
    "broker_target_binding": { "type": "string", "minLength": 1 },
    "broker_run_binding": { "type": "string", "minLength": 1 },
    "broker_job_binding": { "type": "string", "minLength": 1 },
    "approval_ref": { "type": "string", "minLength": 1 },
    "wrkr_inventory_ref": { "type": "string", "minLength": 1 },
    "agent_action_bom_ref": { "type": "string", "minLength": 1 },
    "policy_id": { "type": "string", "minLength": 1 },
    "policy_version": { "type": "string", "minLength": 1 },
    "matched_rule_ids": {
      "type": "array",
      "items": { "type": "string", "minLength": 1 }
    },
    "verdict": { "type": "string", "enum": ["allow", "block", "dry_run", "require_approval"] },
    "context_set_digest": { "type": "string", "pattern": "^[a-fA-F0-9]{64}$" },
    "context_evidence_mode": { "type": "string", "enum": ["best_effort", "required"] },
    "context_ref_count": { "type": "integer", "minimum": 0 },
    "context_source": { "type": "string" },
    "script": { "type": "boolean" },
    "step_count": { "type": "integer", "minimum": 0 },
    "script_hash": { "type": "string", "pattern": "^[a-fA-F0-9]{64}$" },
    "composite_risk_class": { "type": "string" },
    "step_verdicts": {
      "type": "array",
      "items": {
        "type": "object",
        "required": ["index", "tool_name", "verdict"],
        "properties": {
          "index": { "type": "integer", "minimum": 0 },
          "tool_name": { "type": "string" },
          "verdict": { "type": "string", "enum": ["allow", "block", "dry_run", "require_approval"] },
          "reason_codes": { "type": "array", "items": { "type": "string" } },
          "violations": { "type": "array", "items": { "type": "string" } },
          "matched_rule": { "type": "string" }
        },
        "additionalProperties": false
      }
    },
    "pre_approved": { "type": "boolean" },
    "pattern_id": { "type": "string" },
    "registry_reason": { "type": "string" },
    "violations": { "type": "array", "items": { "type": "string" }, "default": [] },
    "latency_ms": { "type": "number" },
    "approval_token_ref": { "type": "string" },
    "freeze_window": {
      "type": "object",
      "properties": {
        "status": { "type": "string", "enum": ["active", "inactive", "invalid"] },
        "effect": { "type": "string", "enum": ["block", "require_approval"] },
        "timezone": { "type": "string", "minLength": 1 },
        "evaluated_at": { "type": "string", "format": "date-time" },
        "window_name": { "type": "string", "minLength": 1 },
        "window_start": { "type": "string", "format": "date-time" },
        "window_end": { "type": "string", "format": "date-time" },
        "reason": { "type": "string", "minLength": 1 },
        "reason_code": { "type": "string", "minLength": 1 }
      },
      "additionalProperties": false
    },
    "sandbox": {
      "type": "object",
      "properties": {
        "status": { "type": "string", "enum": ["disallowed", "invalid", "missing", "valid"] },
        "network_mode": { "type": "string", "enum": ["disabled", "egress_allowlist", "full"] },
        "env_exposure_mode": { "type": "string", "enum": ["allowlist", "full", "none"] },
        "timeout_seconds": { "type": "integer", "minimum": 0 },
        "filesystem_isolation": { "type": "string", "enum": ["container", "none", "workspace"] },
        "user_mode": { "type": "string", "enum": ["default", "root", "unprivileged"] },
        "evidence_ref": { "type": "string", "minLength": 1 },
        "evidence_digest": { "type": "string", "pattern": "^[a-fA-F0-9]{64}$" },
        "reason_codes": {
          "type": "array",
          "items": { "type": "string", "minLength": 1 }
        }
      },
      "additionalProperties": false
    },
    "kill_switch": {
      "type": "object",
      "properties": {
        "status": { "type": "string", "enum": ["active", "inactive", "unavailable"] },
        "reason_code": { "type": "string", "minLength": 1 },
        "reason_codes": {
          "type": "array",
          "items": { "type": "string", "minLength": 1 }
        },
        "matched_entry_ids": {
          "type": "array",
          "items": { "type": "string", "minLength": 1 }
        },
        "evaluated_at": { "type": "string", "format": "date-time" }
      },
      "additionalProperties": false
    },
    "mcp_trust": {
      "type": "object",
      "properties": {
        "server_id": { "type": "string", "minLength": 1 },
        "server_name": { "type": "string", "minLength": 1 },
        "publisher": { "type": "string", "minLength": 1 },
        "source": { "type": "string", "minLength": 1 },
        "status": {
          "type": "string",
          "enum": ["trusted", "missing", "unknown", "untrusted", "invalid", "stale", "below_threshold"]
        },
        "decision_source": { "type": "string", "minLength": 1 },
        "score": { "type": "number" },
        "threshold": { "type": "number" },
        "updated_at": { "type": "string", "format": "date-time" },
        "max_age_seconds": { "type": "integer", "minimum": 0 },
        "required": { "type": "boolean" },
        "enforced": { "type": "boolean" },
        "registry_verified": { "type": "boolean" },
        "publisher_allowed": { "type": "boolean" },
        "reason_codes": { "type": "array", "items": { "type": "string" } }
      },
      "additionalProperties": false
    },
    "delegation_ref": {
      "type": "object",
      "properties": {
        "delegation_token_ref": { "type": "string" },
        "requester_identity": { "type": "string" },
        "delegation_depth": { "type": "integer", "minimum": 0 },
        "scope_class": { "type": "string" },
        "chain_digest": { "type": "string", "pattern": "^[a-fA-F0-9]{64}$" },
        "reason_codes": { "type": "array", "items": { "type": "string" } }
      },
      "additionalProperties": false
    },
    "skill_provenance": {
      "type": "object",
      "required": ["skill_name", "source", "publisher"],
      "properties": {
        "skill_name": { "type": "string", "minLength": 1 },
        "skill_version": { "type": "string" },
        "source": { "type": "string", "minLength": 1 },
        "publisher": { "type": "string", "minLength": 1 },
        "digest": { "type": "string", "pattern": "^[a-fA-F0-9]{64}$" },
        "signature_key_id": { "type": "string" }
      },
      "additionalProperties": false
    },
    "relationship": { "$ref": "#/$defs/relationship_envelope" },
    "signature": {
      "type": "object",
      "required": ["alg", "key_id", "sig"],
      "properties": {
        "alg": { "type": "string" },
        "key_id": { "type": "string" },
        "sig": { "type": "string" },
        "signed_digest": { "type": "string", "pattern": "^[a-fA-F0-9]{64}$" }
      },
      "additionalProperties": false
    }
  },
  "$defs": {
    "relationship_parent_ref": {
      "type": "object",
      "required": ["kind", "id"],
      "properties": {
        "kind": {
          "type": "string",
          "enum": ["trace", "run", "session", "intent", "policy", "agent", "evidence"]
        },
        "id": { "type": "string", "minLength": 1 }
      },
      "additionalProperties": false
    },
    "relationship_entity_ref": {
      "type": "object",
      "required": ["kind", "id"],
      "properties": {
        "kind": {
          "type": "string",
          "enum": ["agent", "tool", "resource", "policy", "run", "trace", "delegation", "evidence"]
        },
        "id": { "type": "string", "minLength": 1 }
      },
      "additionalProperties": false
    },
    "policy_ref": {
      "type": "object",
      "properties": {
        "policy_id": { "type": "string", "minLength": 1 },
        "policy_version": { "type": "string", "minLength": 1 },
        "policy_digest": { "type": "string", "pattern": "^(sha256:)?[a-f0-9]{64}$" },
        "matched_rule_ids": {
          "type": "array",
          "items": { "type": "string", "minLength": 1 },
          "uniqueItems": true
        }
      },
      "additionalProperties": false
    },
    "agent_link": {
      "type": "object",
      "required": ["identity", "role"],
      "properties": {
        "identity": { "type": "string", "minLength": 1 },
        "role": { "type": "string", "enum": ["requester", "delegator", "delegate"] }
      },
      "additionalProperties": false
    },
    "relationship_edge": {
      "type": "object",
      "required": ["kind", "from", "to"],
      "properties": {
        "kind": {
          "type": "string",
          "enum": ["delegates_to", "calls", "governed_by", "targets", "derived_from", "emits_evidence"]
        },
        "from": {
          "type": "object",
          "required": ["kind", "id"],
          "properties": {
            "kind": { "type": "string", "minLength": 1 },
            "id": { "type": "string", "minLength": 1 }
          },
          "additionalProperties": false
        },
        "to": {
          "type": "object",
          "required": ["kind", "id"],
          "properties": {
            "kind": { "type": "string", "minLength": 1 },
            "id": { "type": "string", "minLength": 1 }
          },
          "additionalProperties": false
        }
      },
      "additionalProperties": false
    },
    "agent_lineage": {
      "type": "object",
      "required": ["agent_id"],
      "properties": {
        "agent_id": { "type": "string", "minLength": 1 },
        "delegated_by": { "type": "string", "minLength": 1 },
        "delegation_record_id": { "type": "string", "minLength": 1 }
      },
      "additionalProperties": false
    },
    "relationship_envelope": {
      "type": "object",
      "properties": {
        "parent_ref": { "$ref": "#/$defs/relationship_parent_ref" },
        "entity_refs": {
          "type": "array",
          "items": { "$ref": "#/$defs/relationship_entity_ref" },
          "uniqueItems": true
        },
        "policy_ref": { "$ref": "#/$defs/policy_ref" },
        "agent_chain": {
          "type": "array",
          "items": { "$ref": "#/$defs/agent_link" }
        },
        "edges": {
          "type": "array",
          "items": { "$ref": "#/$defs/relationship_edge" },
          "uniqueItems": true
        },
        "parent_record_id": { "type": "string", "minLength": 1 },
        "related_record_ids": {
          "type": "array",
          "items": { "type": "string", "minLength": 1 },
          "uniqueItems": true
        },
        "related_entity_ids": {
          "type": "array",
          "items": { "type": "string", "minLength": 1 },
          "uniqueItems": true
        },
        "agent_lineage": {
          "type": "array",
          "items": { "$ref": "#/$defs/agent_lineage" }
        }
      },
      "additionalProperties": false
    }
  },
  "additionalProperties": false
}
