{
  "schema_id": "gait.gate.trace",
  "schema_version": "1.0.0",
  "created_at": "2026-02-09T00:00:00Z",
  "producer_version": "0.0.0-dev",
  "trace_id": "trace_skill_1",
  "tool_name": "tool.write",
  "args_digest": "2222222222222222222222222222222222222222222222222222222222222222",
  "intent_digest": "1111111111111111111111111111111111111111111111111111111111111111",
  "policy_digest": "3333333333333333333333333333333333333333333333333333333333333333",
  "verdict": "allow",
  "skill_provenance": {
    "skill_name": "safe-curl",
    "skill_version": "1.0.1",
    "source": "registry",
    "publisher": "acme",
    "digest": "aaaaaaaaaaaaaaaaaaaaaaaaaaaaaaaaaaaaaaaaaaaaaaaaaaaaaaaaaaaaaaaa",
    "signature_key_id": "key_demo"
  }
}
